{
  "schema_version": "news-material/v1",
  "generated_at": "2026-07-11T17:43:35.484568+08:00",
  "result": "populated",
  "events": [
    {
      "event_id": "evt_1c737d45042ff1d50c3017",
      "title": "父母的手机上瘾影响与子女的关系",
      "summary": "一项发表于《Frontiers in Psychology》的研究调查了600名12-17岁美国未成年人，发现父母对智能手机上瘾或屏幕管理不当可能加剧孩子的不安全依恋，导致其人际焦虑、回避、自信心不足，并影响亲密关系与冒险意愿。",
      "primary_category": "technology_in_life",
      "topic_categories": [
        "technology_in_life",
        "youth",
        "social_conflict"
      ],
      "child_hook": "如果你可以发明一个「信号灯」，当父母需要放下手机陪你时它就会亮起来，你希望它最先在一天里的哪个时刻亮起？",
      "age_assessments": {
        "upper_primary": {
          "child_interest_score": 85,
          "age_fit": "fit",
          "reason": "小学生日常能观察到父母使用手机，容易感同身受，也能理解「被忽视」的情绪，但「依恋理论」等心理学概念需要主播用生活化语言解释。"
        },
        "junior_high": {
          "child_interest_score": 92,
          "age_fit": "fit",
          "reason": "初中生正处在自我意识与亲子关系敏感期，研究样本年龄与其重合，极易引发共鸣和与父母的讨论。"
        }
      },
      "safety_tier": "default",
      "safety_tags": [],
      "safety_reason": "话题属于家庭数字生活与儿童心理发展的研究综述，无暴力、死亡、性、自残、仇恨或政治敏感内容，适合所有家长档与年龄档。",
      "needs_fact_check": true,
      "fact_check_targets": [
        "核实《Frontiers in Psychology》是否确有该研究及DOI链接",
        "核实样本量是否为600名、年龄是否为12-17岁",
        "核实研究结论是否确实指向「不安全依恋」与长期心理影响",
        "核实研究发表时间及作者信息"
      ],
      "source_count": 1,
      "sources": [
        {
          "name": "Solidot",
          "role": "lead_source, topic_source",
          "url": "https://www.solidot.org/story?sid=84795",
          "published_at": "2026-07-09T16:43:18+00:00"
        }
      ],
      "scores": {
        "story_score": 68.0,
        "discussion_score": 90.0,
        "knowledge_gain_score": 78.0,
        "life_relevance_score": 95.0,
        "value_pluralism_score": 82.0,
        "audio_fit_score": 88.0
      },
      "human_review": null
    },
    {
      "event_id": "evt_1c7377498f119b4dae3203",
      "title": "What 20 million bans reveal about the strain on Wikipedia’s volunteers",
      "summary": "维基百科数据显示累计约2000万次封禁，揭示志愿者管理员在反破坏、反垃圾信息中的工作压力与平台治理变化。",
      "primary_category": "internet_culture",
      "topic_categories": [
        "internet_culture",
        "technology_in_life",
        "social_conflict"
      ],
      "child_hook": "如果你有一根“管理员魔杖”，能让任何破坏百科的人消失，你会在什么情况下按下它？",
      "age_assessments": {
        "upper_primary": {
          "child_interest_score": 68,
          "age_fit": "fit",
          "reason": "小学生日常使用维基百科查资料，对“谁在看管百科”有好奇；数据与治理规则稍抽象，但可用人际冲突与侦探式叙事降低门槛。"
        },
        "junior_high": {
          "child_interest_score": 75,
          "age_fit": "fit",
          "reason": "初中生熟悉社交媒体规则与网络冲突，能理解“开放编辑”与“封禁破坏者”之间的张力，容易代入讨论。"
        }
      },
      "safety_tier": "default",
      "safety_tags": [],
      "safety_reason": "话题为网络平台治理与志愿者工作压力，无暴力、灾难、疾病或未成年敏感内容；涉及网络破坏与封禁，但属于抽象的平台规则讨论，无危险操作指引。",
      "needs_fact_check": true,
      "fact_check_targets": [
        "20 million bans 的统计时间范围与是否包含重复账号、IP 封禁",
        "维基百科活跃管理员与志愿者数量近年变化趋势",
        "封禁政策或执行标准是否出现显著变化"
      ],
      "source_count": 1,
      "sources": [
        {
          "name": "The Conversation",
          "role": "explainer_source, viewpoint_source",
          "url": "https://theconversation.com/what-20-million-bans-reveal-about-the-strain-on-wikipedias-volunteers-274818",
          "published_at": "2026-06-25T12:35:20+00:00"
        }
      ],
      "scores": {
        "story_score": 72.0,
        "discussion_score": 85.0,
        "knowledge_gain_score": 80.0,
        "life_relevance_score": 70.0,
        "value_pluralism_score": 80.0,
        "audio_fit_score": 85.0
      },
      "human_review": null
    },
    {
      "event_id": "evt_1c73786f8925a286fdb299",
      "title": "‘Beautiful blobs’: can scientists build life from scratch? – podcast",
      "summary": "科学家用实验室合成的DNA造出会蠕动、进食、生长和繁殖的“美丽小液滴”，向“从零创造生命”迈进，相关进展与伦理争议引发讨论。",
      "primary_category": "discovery",
      "topic_categories": [
        "discovery",
        "technology_in_life"
      ],
      "child_hook": "If scientists built a tiny living blob from scratch, would it be more like a creature or a machine—and should we have rules for it?",
      "age_assessments": {
        "upper_primary": {
          "child_interest_score": 80,
          "age_fit": "fit",
          "reason": "Quivering blobs that grow and multiply feel like sci-fi slime, appealing to curiosity; basic biology concepts are understandable."
        },
        "junior_high": {
          "child_interest_score": 85,
          "age_fit": "fit",
          "reason": "Synthetic DNA and artificial cells connect to genetics and bioethics, naturally engaging older students."
        }
      },
      "safety_tier": "default",
      "safety_tags": [],
      "safety_reason": "Scientific research story about synthetic biology; no graphic violence, death, sexual content, or dangerous instruction. Ethical questions can be handled neutrally.",
      "needs_fact_check": true,
      "fact_check_targets": [
        "Confirm that University of Minnesota professor Kate Adamala is quoted in the podcast.",
        "Verify the claim that lab-made blobs use synthetic DNA to feed, grow, and multiply.",
        "Confirm publication date and that it is from The Guardian Science podcast.",
        "Check whether researchers describe this as 'creating life from scratch' versus a step toward synthetic cells."
      ],
      "source_count": 1,
      "sources": [
        {
          "name": "The Guardian",
          "role": "viewpoint_source, topic_source",
          "url": "https://www.theguardian.com/science/audio/2026/jul/02/beautiful-blobs-can-scientists-build-life-from-scratch-podcast",
          "published_at": "2026-07-02T04:00:05+00:00"
        }
      ],
      "scores": {
        "story_score": 78.0,
        "discussion_score": 85.0,
        "knowledge_gain_score": 85.0,
        "life_relevance_score": 60.0,
        "value_pluralism_score": 80.0,
        "audio_fit_score": 85.0
      },
      "human_review": null
    },
    {
      "event_id": "evt_1c73793b12e2d43663aff4",
      "title": "Why are our fingers different lengths?",
      "summary": "科学解释人类五根手指长度不一的原因：涉及进化压力、胚胎发育和手部功能分工，帮助孩子从自己身上发现生物学问题。",
      "primary_category": "discovery",
      "topic_categories": [
        "discovery"
      ],
      "child_hook": "如果你可以重新设计自己的一只手，你会让五根手指一样长吗？还是说，不同长度其实各有各的妙用？",
      "age_assessments": {
        "upper_primary": {
          "child_interest_score": 85,
          "age_fit": "fit",
          "reason": "问题直接来自孩子自己的身体，容易观察、触摸和提问，符合小学中高年级好奇心。"
        },
        "junior_high": {
          "child_interest_score": 78,
          "age_fit": "fit",
          "reason": "内容涉及进化、发育与功能适应，适合初中生作为生物学科普，但悬念感略低于新闻事件。"
        }
      },
      "safety_tier": "default",
      "safety_tags": [],
      "safety_reason": "纯科学解释类内容，无暴力、死亡、疾病、政治或社会争议，适合默认分级。",
      "needs_fact_check": true,
      "fact_check_targets": [
        "核实文中关于手指长度差异的进化与发育机制表述是否准确",
        "核实是否有具体研究或数据支持手指长度比例与功能的关联"
      ],
      "source_count": 1,
      "sources": [
        {
          "name": "The Conversation",
          "role": "explainer_source, viewpoint_source",
          "url": "https://theconversation.com/why-are-our-fingers-different-lengths-282709",
          "published_at": "2026-07-06T12:14:19+00:00"
        }
      ],
      "scores": {
        "story_score": 60.0,
        "discussion_score": 85.0,
        "knowledge_gain_score": 90.0,
        "life_relevance_score": 95.0,
        "value_pluralism_score": 25.0,
        "audio_fit_score": 90.0
      },
      "human_review": null
    },
    {
      "event_id": "evt_1c73798d7ebee0b8b8f464",
      "title": "Air pollution linked to DNA changes in sperm, research shows",
      "summary": "A large study of over 2,000 men in Salt Lake City found that common air pollutants, especially ozone and nitrogen dioxide, may cause epigenetic changes in sperm DNA, raising concerns about how air pollution affects male fertility and reproductive health.",
      "primary_category": "discovery",
      "topic_categories": [
        "discovery",
        "technology_in_life"
      ],
      "child_hook": "If the air you breathe could leave tiny instructions inside your body's cells, what kind of future might those instructions help shape?",
      "age_assessments": {
        "upper_primary": {
          "child_interest_score": 50,
          "age_fit": "unfit",
          "reason": "While the idea of air pollution changing DNA is fascinating, the topic of sperm, fertility, and reproduction is too mature for most upper primary listeners, even in a scientific framing."
        },
        "junior_high": {
          "child_interest_score": 75,
          "age_fit": "maybe",
          "reason": "Junior high students have the biology background to engage with epigenetics and environmental health, but the reproductive framing requires careful, age-appropriate presentation and may not suit all family contexts."
        }
      },
      "safety_tier": "sensitive",
      "safety_tags": [
        "reproductive_health",
        "fertility",
        "biology",
        "environmental_pollution"
      ],
      "safety_reason": "The story touches on sperm, fertility, and epigenetic changes, which are reproductive biology topics. It contains no graphic or sexual content, but the framing is likely too mature for upper primary listeners. For junior high, it is appropriate as health science under standard and open frameworks, but conservative families may prefer to avoid it.",
      "needs_fact_check": true,
      "fact_check_targets": [
        "Verify Dr Carrie Nobles is an epidemiologist at the University of Massachusetts Amherst and led the study",
        "Verify the study was presented at the annual meeting of the European Society of Human Reproduction and Embryology in London",
        "Verify the study followed over 2,000 men in Salt Lake City, Utah, between 2013 and 2017",